{
  "$schema": "../../../lib/trellis.release.schema.json",
  "schema_version": 1,
  "version": "1.0.0-rc.24",
  "tag": "v1.0.0-rc.24",
  "commit": "aaaaaaaaaaaaaaaaaaaaaaaaaaaaaaaaaaaaaaaa",
  "remote": "git@github.com:Zireael26/trellis.git",
  "tree": [
    {
      "path": "core-rules/VERSION",
      "mode": "100644",
      "oid": "bbbbbbbbbbbbbbbbbbbbbbbbbbbbbbbbbbbbbbbb"
    },
    {
      "path": "core-rules/CLAUDE.md",
      "mode": "100644",
      "oid": "cccccccccccccccccccccccccccccccccccccccc"
    },
    {
      "path": "core-rules/hooks/stop-verify.sh",
      "mode": "100755",
      "oid": "dddddddddddddddddddddddddddddddddddddddd"
    },
    {
      "path": "core-rules/codex/hooks/session-context.sh",
      "mode": "100644",
      "oid": "eeeeeeeeeeeeeeeeeeeeeeeeeeeeeeeeeeeeeeee"
    }
  ]
}
